{"assumptions":["Unconfoundedness: given observed covariates, treatment is independent of potential outcomes. Untestable; the U edges in the DAG are exactly what it rules out.","Overlap: every covariate profile has a chance of both treatment and comparison. Checked by propensity distribution and weight diagnostics; weak for PSID.","SUTVA / consistency: no interference between participants and one version of treatment.","Correct specification: the outcome and propensity models are approximations; results are sensitive to them.","The experiment supports a causal reading only for the NSW volunteer population (external validity not established)."],"dag":{"edges":[["X","T"],["X","Y"],["P","T"],["P","Y"],["X","P"],["T","Y"],["U","T"],["U","Y"],["U","P"]],"nodes":[{"id":"X","label":"age, education, race, marital status, no-degree"},{"id":"P","label":"prior earnings re74, re75"},{"id":"T","label":"training (treat)"},{"id":"Y","label":"earnings 1978 (re78)"},{"id":"U","label":"unobserved motivation / ability","unobserved":true}],"note":"In the experiment T is randomized (no incoming edges). In the PSID comparison T is selection: the U edges are the threat to the observational estimators."},"generated_at":"2026-10-11T00:00:00Z","nsw":{"balance":[{"covariate":"age","smd_experiment":0.107,"smd_psid_ipw":0.168,"smd_psid_raw":-1.009},{"covariate":"education","smd_experiment":0.141,"smd_psid_ipw":-0.033,"smd_psid_raw":-0.681},{"covariate":"black","smd_experiment":0.044,"smd_psid_ipw":0.137,"smd_psid_raw":1.48},{"covariate":"hispanic","smd_experiment":-0.175,"smd_psid_ipw":-0.158,"smd_psid_raw":0.129},{"covariate":"married","smd_experiment":0.094,"smd_psid_ipw":0.107,"smd_psid_raw":-1.842},{"covariate":"nodegree","smd_experiment":-0.304,"smd_psid_ipw":0.031,"smd_psid_raw":0.879},{"covariate":"re74","smd_experiment":-0.002,"smd_psid_ipw":-0.115,"smd_psid_raw":-1.718},{"covariate":"re75","smd_experiment":0.084,"smd_psid_ipw":-0.219,"smd_psid_raw":-1.774}],"benchmark":{"ci95":[479.21,3109.47],"estimate":1794.34,"n_control":260,"n_treated":185,"regression_adjusted_in_experiment":1669.84,"se":671.0,"tag":"OBSERVED/DERIVED","unit":"USD 1978"},"duplicates_in_nsw":15,"experiment_estimators":{"ipw_att":{"ci95":[189.23,3316.33],"estimate":1756.73,"gap_vs_benchmark":-37.61},"naive":{"ci95":[464.75,3264.41],"estimate":1794.34,"gap_vs_benchmark":0.0},"ols_coef":{"ci95":[341.55,3126.75],"estimate":1669.84,"gap_vs_benchmark":-124.5},"ra_att":{"ci95":[176.05,3213.41],"estimate":1703.99,"gap_vs_benchmark":-90.35}},"means":{"control_re78":4554.8,"psid_re78":21553.92,"treated_re78":6349.14},"observational_estimators":{"ipw_att":{"ci95":[-1145.81,2970.08],"estimate":1281.5,"gap_vs_benchmark":-512.84},"naive":{"ci95":[-16391.67,-13824.07],"estimate":-15204.78,"gap_vs_benchmark":-16999.12},"ols_coef":{"ci95":[-1620.81,1859.9],"estimate":67.28,"gap_vs_benchmark":-1727.06},"ra_att":{"ci95":[-1142.03,2603.03],"estimate":740.35,"gap_vs_benchmark":-1054.0}},"observational_sample":{"n_psid_controls":2490,"n_treated":185},"overlap":{"control_ps_mean":0.0303,"controls_ps_gt_0_5":23,"ess_controls":11.9,"ipw_clip":[0.01,0.99],"max_control_weight_share":0.234,"treated_ps_mean":0.6922}},"schema_version":"v1","spec":{"benchmark":"experimental difference in means on the NSW (Dehejia-Wahba) randomized sample","bootstrap":"500 resamples, numpy PCG64 seed 20261011, percentile CI","citations":["LaLonde 1986 AER 76","Dehejia and Wahba 1999 JASA 94","Dehejia and Wahba 2002 REStat 84"],"data_terms":"NBER nsw_dw.dta and psid_controls.dta, attributable non-commercial use (CC by NC); derived results only; no row-level data published","estimators":"analytics/causal.py docstring","link":"https://users.nber.org/~rdehejia/nswdata2.html","scope":"NSW results are precomputed (microdata is not shipped). The browser reruns the estimators on the SYNTHETIC environment, with parity vectors.","target":"ATT in all estimators"},"synthetic":{"dgp":"x1,x2 ~ N(0,1); treated if uniform < sigmoid(gamma (0.8 x1 + 0.6 x2)); y = tau t + 2 x1 + 1.5 x2 + N(0,1); tau = 1","reps":30,"reps_mean":{"0.0":{"ipw_att":1.012,"naive":1.0781,"ols_coef":1.0089,"ra_att":1.0082},"1.0":{"ipw_att":0.9971,"naive":3.1233,"ols_coef":1.0198,"ra_att":1.0211}}},"tags":{"dag":"DERIVED","nsw":"OBSERVED/DERIVED","synthetic":"SYNTHETIC","vectors":"SYNTHETIC"},"tolerance":{"abs":1e-06,"note":"synthetic estimators, Newton fixed 25 iterations","rel":1e-06},"vectors":[{"ess_controls":479.186076,"gamma":0.0,"ipw_att":0.96003021,"n":1000,"n_treated":520,"naive":0.97750887,"ols_coef":0.96387636,"ps_beta":[0.08007385,0.02867487,-0.0273944],"ra_att":0.96496311,"seed":101,"tau_true":1.0},{"ess_controls":389.985663,"gamma":0.5,"ipw_att":1.24891306,"n":1000,"n_treated":480,"naive":2.43298679,"ols_coef":1.11926173,"ps_beta":[-0.08529465,0.51806529,0.28758686],"ra_att":1.11749492,"seed":102,"tau_true":1.0},{"ess_controls":200.469048,"gamma":1.0,"ipw_att":0.82261923,"n":1000,"n_treated":503,"naive":3.10715937,"ols_coef":0.9467174,"ps_beta":[0.01629733,0.83431218,0.67104232],"ra_att":0.92578148,"seed":103,"tau_true":1.0},{"ess_controls":137.916523,"gamma":1.5,"ipw_att":1.08243694,"n":1000,"n_treated":498,"naive":3.57373535,"ols_coef":0.98806059,"ps_beta":[-0.02532712,1.17140308,0.79696384],"ra_att":1.01414676,"seed":104,"tau_true":1.0}]}